{
  "schema_version": "0.1.0",
  "mode": "read_only_snapshot",
  "observed_at": "2026-10-12T11:10:00Z",
  "scope": {
    "organizations": [
      "dcc-mcp",
      "try-auroraview",
      "vx-org"
    ],
    "discovered_public_repositories": {
      "dcc-mcp": 103,
      "try-auroraview": 12,
      "vx-org": 8
    },
    "representative_repositories": 15,
    "limits": "Representative current workflows plus recent public PRs and exact-head runs. No secret values, secret APIs, settings mutations, releases, merges or full clones."
  },
  "repositories": [
    {
      "repository": "dcc-mcp/.github",
      "classification": "central_read_only_gates",
      "finding": "Existing reusable repo-contract, release-ci-gate, release-integrity and catalog-sync; no central PR-writer reusable.",
      "source_files": [
        {
          "path": ".github/workflows/repo-contract.yml",
          "blob_sha": "43ed4b76dc651678aa8966aaf4db7b0ba208f4f1",
          "url": "https://github.com/dcc-mcp/.github/blob/main/.github/workflows/repo-contract.yml",
          "secret_name_references": []
        },
        {
          "path": ".github/workflows/release-ci-gate.yml",
          "blob_sha": "dda59d8976e2b44d378b454e296184139a63b714",
          "url": "https://github.com/dcc-mcp/.github/blob/main/.github/workflows/release-ci-gate.yml",
          "secret_name_references": []
        },
        {
          "path": ".github/workflows/release-integrity.yml",
          "blob_sha": "0a5e1c3b6ba6e92e2eccfde77b1a078d53f9c975",
          "url": "https://github.com/dcc-mcp/.github/blob/main/.github/workflows/release-integrity.yml",
          "secret_name_references": []
        },
        {
          "path": ".github/workflows/catalog-sync.yml",
          "blob_sha": "2eef71f08da1de0aa2a89320e9b88e3a3cf1aee1",
          "url": "https://github.com/dcc-mcp/.github/blob/main/.github/workflows/catalog-sync.yml",
          "secret_name_references": []
        }
      ],
      "credential_availability": "not_verified"
    },
    {
      "repository": "dcc-mcp/dcc-mcp-core",
      "classification": "mixed_automation",
      "finding": "Release Please explicitly uses PERSONAL_ACCESS_TOKEN. Adapter pointer writer fans out across catalog, with credential and git transport explicitly bound. Existing #2752/#2753 must be reused.",
      "source_files": [
        {
          "path": ".github/workflows/release.yml",
          "blob_sha": "7118f644950d3fc79ab879de63cbcc1aeaa59982",
          "url": "https://github.com/dcc-mcp/dcc-mcp-core/blob/main/.github/workflows/release.yml",
          "secret_name_references": [
            "PERSONAL_ACCESS_TOKEN",
            "WINGET_TOKEN",
            "GITHUB_TOKEN",
            "MULTICA_CORE_RELEASE_READY_WEBHOOK_URL"
          ]
        },
        {
          "path": ".github/workflows/adapter-coverage.yml",
          "blob_sha": "d9e66b1ed8283ef08176ec923b203c99bcd12c5b",
          "url": "https://github.com/dcc-mcp/dcc-mcp-core/blob/main/.github/workflows/adapter-coverage.yml",
          "secret_name_references": [
            "PERSONAL_ACCESS_TOKEN"
          ]
        },
        {
          "path": ".github/workflows/generated-lock-repair.yml",
          "blob_sha": "68e37952178450f850366a216a5d73918ecf130b",
          "url": "https://github.com/dcc-mcp/dcc-mcp-core/blob/main/.github/workflows/generated-lock-repair.yml",
          "secret_name_references": [
            "PERSONAL_ACCESS_TOKEN"
          ]
        },
        {
          "path": ".github/workflows/repo-contract.yml",
          "blob_sha": "63f91f1dc7245ddb087ac0c73b7b0e18791dcef6",
          "url": "https://github.com/dcc-mcp/dcc-mcp-core/blob/main/.github/workflows/repo-contract.yml",
          "secret_name_references": []
        }
      ],
      "credential_availability": "not_verified"
    },
    {
      "repository": "dcc-mcp/dcc-mcp-obs",
      "classification": "approval_blocked",
      "finding": "Release Please uses GITHUB_TOKEN.",
      "source_files": [
        {
          "path": ".github/workflows/release-please.yml",
          "blob_sha": "82fb7400be7cf3825ae58084f7625b351d498b15",
          "url": "https://github.com/dcc-mcp/dcc-mcp-obs/blob/main/.github/workflows/release-please.yml",
          "secret_name_references": [
            "GITHUB_TOKEN"
          ]
        }
      ],
      "credential_availability": "not_verified"
    },
    {
      "repository": "dcc-mcp/dcc-cua",
      "classification": "approval_blocked",
      "finding": "Release Please uses PERSONAL_ACCESS_TOKEN but current release-PR refresh uses GITHUB_TOKEN and checkout default credentials; #319 exists.",
      "source_files": [
        {
          "path": ".github/workflows/release-please.yml",
          "blob_sha": "24598bf9db3dc07e4e4b3ce42a78b3a2add63610",
          "url": "https://github.com/dcc-mcp/dcc-cua/blob/main/.github/workflows/release-please.yml",
          "secret_name_references": [
            "GITHUB_TOKEN",
            "PERSONAL_ACCESS_TOKEN",
            "EDGE_ADDONS_API_KEY",
            "FIREFOX_AMO_API_KEY",
            "FIREFOX_AMO_API_SECRET"
          ]
        }
      ],
      "credential_availability": "not_verified"
    },
    {
      "repository": "dcc-mcp/dcc-mcp-illustrator",
      "classification": "approval_blocked",
      "finding": "Release Please uses github.token.",
      "source_files": [
        {
          "path": ".github/workflows/release.yml",
          "blob_sha": "c283b302942fa9b14105bb67d581429363592df8",
          "url": "https://github.com/dcc-mcp/dcc-mcp-illustrator/blob/main/.github/workflows/release.yml",
          "secret_name_references": []
        }
      ],
      "credential_availability": "not_verified"
    },
    {
      "repository": "dcc-mcp/dcc-mcp-liquigen",
      "classification": "approval_blocked",
      "finding": "Release Please uses github.token.",
      "source_files": [
        {
          "path": ".github/workflows/release.yml",
          "blob_sha": "9388444a9132957a74d23401225816ec256e37a6",
          "url": "https://github.com/dcc-mcp/dcc-mcp-liquigen/blob/main/.github/workflows/release.yml",
          "secret_name_references": []
        }
      ],
      "credential_availability": "not_verified"
    },
    {
      "repository": "dcc-mcp/dcc-mcp-nuke",
      "classification": "explicit_existing_credential",
      "finding": "Merged #75 requires PERSONAL_ACCESS_TOKEN and fails closed if empty; actual credential availability not verified.",
      "source_files": [
        {
          "path": ".github/workflows/release.yaml",
          "blob_sha": "d01c24185ee97634b5e95dbd63c9aa06de10f074",
          "url": "https://github.com/dcc-mcp/dcc-mcp-nuke/blob/main/.github/workflows/release.yaml",
          "secret_name_references": [
            "PERSONAL_ACCESS_TOKEN"
          ]
        }
      ],
      "credential_availability": "not_verified"
    },
    {
      "repository": "try-auroraview/.github",
      "classification": "profile_only",
      "finding": "Only .github/workflows/check.yml, for profile content; no central automation workflows.",
      "source_files": [],
      "credential_availability": "not_verified"
    },
    {
      "repository": "try-auroraview/auroraview",
      "classification": "approval_blocked",
      "finding": "Release Please uses GITHUB_TOKEN; independent release graph retained.",
      "source_files": [
        {
          "path": ".github/workflows/release.yml",
          "blob_sha": "481557d47fbe95caa376082727bce2956f2a98ec",
          "url": "https://github.com/try-auroraview/auroraview/blob/main/.github/workflows/release.yml",
          "secret_name_references": [
            "GITHUB_TOKEN"
          ]
        }
      ],
      "credential_availability": "not_verified"
    },
    {
      "repository": "try-auroraview/auroraview-web-sdk",
      "classification": "approval_blocked",
      "finding": "Release Please uses GITHUB_TOKEN; npm/OIDC and GitHub assets are separate paths.",
      "source_files": [
        {
          "path": ".github/workflows/release.yml",
          "blob_sha": "794fd6d3911993250e979079c2759aee3363020d",
          "url": "https://github.com/try-auroraview/auroraview-web-sdk/blob/main/.github/workflows/release.yml",
          "secret_name_references": [
            "GITHUB_TOKEN"
          ]
        }
      ],
      "credential_availability": "not_verified"
    },
    {
      "repository": "vx-org/.github",
      "classification": "profile_only",
      "finding": "Full recursive tree contains profile assets, no .github/workflows.",
      "source_files": [],
      "credential_availability": "not_verified"
    },
    {
      "repository": "vx-org/vx",
      "classification": "fallback_and_compensation",
      "finding": "Release Please uses PERSONAL_ACCESS_TOKEN || GITHUB_TOKEN; explicit release dispatch, stale-main guard and same-head metadata status path already exist. Do not replace these with a generic publisher.",
      "source_files": [
        {
          "path": ".github/workflows/release-please.yml",
          "blob_sha": "4e2abd222123d2e6a0d0399f1fc2e5b487fd4b27",
          "url": "https://github.com/vx-org/vx/blob/main/.github/workflows/release-please.yml",
          "secret_name_references": [
            "GITHUB_TOKEN",
            "PERSONAL_ACCESS_TOKEN"
          ]
        },
        {
          "path": ".github/workflows/repo-contract.yml",
          "blob_sha": "63f91f1dc7245ddb087ac0c73b7b0e18791dcef6",
          "url": "https://github.com/vx-org/vx/blob/main/.github/workflows/repo-contract.yml",
          "secret_name_references": []
        }
      ],
      "credential_availability": "not_verified"
    },
    {
      "repository": "vx-org/rez-next",
      "classification": "working_existing_credential",
      "finding": "Release Please uses RELEASE_PLZ_TOKEN || GITHUB_TOKEN; #379 created by loonghao, CI/SDK/benchmark succeeded.",
      "source_files": [
        {